{
  "$schema": "https://json-schema.org/draft/2020-12/schema",
  "$id": "https://raw.githubusercontent.com/andreasaracino/torstream-providers/main/schema/provider.schema.json",
  "title": "Torstream provider definition",
  "description": "Declarative, data-only description of how to query a provider. v2 (validated in Spike S5 with The Pirate Bay API and SubsPlease).",
  "type": "object",
  "required": [
    "schemaVersion",
    "id",
    "name",
    "version",
    "type",
    "categories",
    "languages",
    "baseUrls",
    "search",
    "mapping",
    "limits"
  ],
  "additionalProperties": false,
  "properties": {
    "schemaVersion": {
      "const": 2
    },
    "id": {
      "type": "string",
      "pattern": "^[a-z0-9][a-z0-9-]{1,40}$"
    },
    "name": {
      "type": "string",
      "minLength": 1,
      "maxLength": 60
    },
    "version": {
      "type": "integer",
      "minimum": 1,
      "description": "Bumped on every change to this definition."
    },
    "description": {
      "type": "string",
      "maxLength": 300
    },
    "type": {
      "enum": [
        "json-api",
        "html",
        "rss",
        "stremio-addon",
        "torznab"
      ]
    },
    "categories": {
      "type": "array",
      "minItems": 1,
      "uniqueItems": true,
      "items": {
        "enum": [
          "movie",
          "series",
          "anime",
          "other"
        ]
      }
    },
    "languages": {
      "type": "array",
      "minItems": 1,
      "uniqueItems": true,
      "items": {
        "type": "string",
        "pattern": "^[a-z]{2,3}$"
      },
      "description": "ISO 639 codes of the content languages the provider mostly lists."
    },
    "baseUrls": {
      "type": "array",
      "minItems": 1,
      "items": {
        "type": "string",
        "format": "uri",
        "pattern": "^https://"
      },
      "description": "Mirrors, tried in order (failover)."
    },
    "fetch": {
      "type": "object",
      "additionalProperties": false,
      "properties": {
        "mode": {
          "enum": [
            "http",
            "webview"
          ],
          "default": "http"
        },
        "headers": {
          "type": "object",
          "additionalProperties": {
            "type": "string"
          }
        }
      }
    },
    "search": {
      "type": "object",
      "additionalProperties": false,
      "minProperties": 1,
      "description": "Path/query templates relative to a base URL. Placeholders: {imdb} {tmdb} {anilist} {query} {season} {episode} {page}; '{name:0N}' zero-pads to N digits. Values are URL-encoded. The runtime runs every applicable template (e.g. byImdb + byQuery) and merges results by infohash.",
      "properties": {
        "byImdb": {
          "type": "string"
        },
        "byTmdb": {
          "type": "string"
        },
        "byAnilist": {
          "type": "string"
        },
        "byQuery": {
          "type": "string"
        },
        "byQueryEpisode": {
          "type": "string"
        }
      }
    },
    "detail": {
      "type": "object",
      "additionalProperties": false,
      "description": "Optional second request per item, when the list page lacks the magnet/infohash.",
      "properties": {
        "url": {
          "type": "string",
          "description": "Mapping path in the list item that yields the detail URL."
        },
        "mapping": {
          "$ref": "#/$defs/fieldMapping"
        }
      }
    },
    "mapping": {
      "type": "object",
      "additionalProperties": false,
      "required": [
        "items",
        "fields"
      ],
      "properties": {
        "items": {
          "type": "string",
          "description": "JSONPath (json-api, stremio-addon, torznab) or CSS selector (html, rss) selecting result items (or groups, when 'each' is set). For html, 'selector @closest tag' takes the enclosing element of each match."
        },
        "fields": {
          "$ref": "#/$defs/fieldMapping"
        },
        "each": {
          "type": "string",
          "description": "Optional JSONPath, evaluated on each item, expanding it into sub-items (e.g. one per resolution). Field expressions then use '$' for the sub-item and '$$' for the parent item."
        }
      }
    },
    "limits": {
      "type": "object",
      "additionalProperties": false,
      "required": [
        "rps",
        "timeoutMs",
        "maxResponseKb"
      ],
      "properties": {
        "rps": {
          "type": "number",
          "exclusiveMinimum": 0,
          "maximum": 10
        },
        "timeoutMs": {
          "type": "integer",
          "minimum": 1000,
          "maximum": 30000
        },
        "maxResponseKb": {
          "type": "integer",
          "minimum": 16,
          "maximum": 8192
        },
        "maxPages": {
          "type": "integer",
          "minimum": 1,
          "maximum": 5,
          "default": 1
        }
      }
    },
    "filters": {
      "type": "array",
      "description": "Drop results whose normalized field matches the regex (e.g. placeholder 'no results' rows).",
      "items": {
        "type": "object",
        "additionalProperties": false,
        "required": [
          "field",
          "notMatch"
        ],
        "properties": {
          "field": {
            "enum": [
              "name",
              "infohash",
              "size",
              "seeders",
              "leechers",
              "imdb"
            ]
          },
          "notMatch": {
            "type": "string"
          }
        }
      }
    },
    "private": {
      "type": "boolean",
      "default": false,
      "description": "A private tracker: its torrents carry the user's passkey (app ADR-0031)."
    },
    "auth": {
      "type": "object",
      "additionalProperties": false,
      "required": [
        "loginPath"
      ],
      "description": "The provider needs the user's account: the app opens loginPath in a web view, the user logs in there, and the session cookies go with every request (app ADR-0031).",
      "properties": {
        "loginPath": {
          "type": "string"
        },
        "loggedOutMarker": {
          "type": "string",
          "description": "Text of the page shown instead of results when the session is missing or expired."
        },
        "cookies": {
          "type": "array",
          "items": {
            "type": "string"
          },
          "description": "Cookie names that mean 'logged in'."
        }
      }
    }
  },
  "$defs": {
    "fieldMapping": {
      "type": "object",
      "additionalProperties": false,
      "description": "Each value is a JSONPath ('$…' on the item, '$$…' on the parent item when 'each' is used; CSS selector with '@attr' for html) or a template with {path} references, e.g. '[Group] {$$.show} - {$$.episode} ({$.res}p)'. Numeric fields are coerced from strings. From 'magnet' the runtime derives the hex infohash (hex or base32 btih), the size ('xl') and a fallback name ('dn'). 'uploaded' accepts unix seconds or RFC 2822 dates. For html, ' ~ regex' keeps the regex's first group, and ' || ' separates alternatives tried in order.",
      "properties": {
        "name": {
          "type": "string"
        },
        "infohash": {
          "type": "string"
        },
        "magnet": {
          "type": "string"
        },
        "torrentUrl": {
          "type": "string"
        },
        "size": {
          "type": "string"
        },
        "seeders": {
          "type": "string"
        },
        "leechers": {
          "type": "string"
        },
        "uploaded": {
          "type": "string"
        },
        "fileIndex": {
          "type": "string"
        },
        "detailUrl": {
          "type": "string"
        },
        "imdb": {
          "type": "string"
        },
        "public": {
          "type": "string",
          "description": "For a private provider: non-empty when this row is a public torrent (e.g. it has a magnet), which plays normally."
        }
      },
      "anyOf": [
        {
          "required": [
            "infohash"
          ]
        },
        {
          "required": [
            "magnet"
          ]
        },
        {
          "required": [
            "torrentUrl"
          ]
        },
        {
          "required": [
            "detailUrl"
          ]
        }
      ]
    }
  }
}
